,Unnamed: 0,Unnamed: 0.1,vid,title,description,thumbnail,view_counts,t_emoji_count,t_word_count,t_punctuation_count,t_length,t_lang,d_emoji_count,d_word_count,d_punctuation_count,d_length,d_lang
1029,1029,29,I_sL2nbhbBM,4 Anime Mythics at the SAME Time 🤩,Join PWR Discord: https://discord.gg/pwr Subscribe to Lachy Shorts! http://bit.ly/LachyShortsSubscribe ⚡️My APPAREL⚡️ ...,https://i.ytimg.com/vi/I_sL2nbhbBM/default.jpg,231546,1,7,0,34,en,2,17,15,121,en
1030,1030,30,HHq6G0fiB2o,Q&amp;A Saturday with my neighbor #anime #naruto #itachi,,https://i.ytimg.com/vi/HHq6G0fiB2o/default.jpg,5301370,0,10,5,56,en,0,1,0,3,tl
1031,1031,31,2EekwHf39zI,Denji grabbing Powers B**bs pt2 @PiathePanda #chainsawman #anime #naruto,,https://i.ytimg.com/vi/2EekwHf39zI/default.jpg,2464059,0,10,6,72,en,0,1,0,3,tl
1032,1032,32,PdvaxlUsUVk,Oniichan V.S. José Roberto Pt.2 🤝🏻 #otakulife #humor #oniichan #comedy #anime #fypシ #joseroberto,,https://i.ytimg.com/vi/PdvaxlUsUVk/default.jpg,277831,1,14,10,96,en,0,1,0,3,tl
1033,1033,33,MNQPZaxPEbw,Nya! Power #anime #chainsawman #power,,https://i.ytimg.com/vi/MNQPZaxPEbw/default.jpg,10145768,0,5,4,37,en,0,1,0,3,tl
1034,1034,34,eLkfQYus8yo,Goku + Sharingan + Rinnegan = 💀 😂 #anime #shorts,,https://i.ytimg.com/vi/eLkfQYus8yo/default.jpg,16180022,2,5,5,48,en,0,1,0,3,tl
1035,1035,35,rZeky4aRoWU,It’s been 15 Years 😂😂 #anime #dbz #stopmotion #comedy #fyp,,https://i.ytimg.com/vi/rZeky4aRoWU/default.jpg,460652,2,10,5,58,en,0,1,0,3,tl
1036,1036,36,FoiL5toLJok,MAKIMA&#39;S DEAD #celebration #short #chainsawman #makima #fyp #trending #viral #asmr #anime #animeedit,,https://i.ytimg.com/vi/FoiL5toLJok/default.jpg,1742011,0,14,13,104,en,0,1,0,3,tl
1037,1037,37,PHGmXzmqyHg,junji ito maniac manga vs anime #anime,,https://i.ytimg.com/vi/PHGmXzmqyHg/default.jpg,4578,0,7,1,38,sl,0,1,0,3,tl
1038,1038,38,yEvnxYlVzuA,Game of Thrones as an 80&#39;s Dark Fantasy Anime Film,"0:00 Jon Snow 0:11 The Wall 0:16 Arya Stark 0:21 Eddard ""Ned"" Stark 0:31 Winterfell 0:36 Daenerys Targaryen 0:51 King's ...",https://i.ytimg.com/vi/yEvnxYlVzuA/default.jpg,41666,0,12,3,54,en,0,28,13,123,en
1039,1039,39,NrCh4dVoZrE,Preguntas de Naruto en Fortnite 🍥Anime naruto shippuden y boruto #naruto #anime #fortnite,Esta es una seccion de preguntas y respuestas de Naruto shippuden y boruto con tematica de Fortnite retos #naruto #anime ...,https://i.ytimg.com/vi/NrCh4dVoZrE/default.jpg,41842,1,13,3,89,it,0,20,5,124,es
1040,1040,40,4b1CeRJd-9g,when you watch too much anime...,TIKTOK - https://www.tiktok.com/@lilypichu ❀WEBSITE - https://www.lilypichu.com ❀LilyGaming ...,https://i.ytimg.com/vi/4b1CeRJd-9g/default.jpg,154410,0,6,3,32,en,0,12,17,95,en
1041,1041,41,fs_mH4QnAe4,Anime MasterChef  AMV - Audience Choice Japan Expo 2017,"I tried to edit an amv like this for a long time, but I never started it because I didn't find a good song... this year at soul's team IC I ...",https://i.ytimg.com/vi/fs_mH4QnAe4/default.jpg,9494861,0,8,1,55,en,0,33,9,143,en
1042,1042,42,6RjJEAX-z8Y,When an Anime only focuses on Boxing,FOLLOW @SUPREMEDREAMS_1 AND @RDCWORLD1 FOR MORE CONTENT/UPDATES ~RDC Social Media ...,https://i.ytimg.com/vi/6RjJEAX-z8Y/default.jpg,1294695,0,7,0,36,en,0,11,8,85,en
1043,1043,43,TB464lz0zkY,Top 10 Romance Anime To Watch In 2022,anime #animeshorts #shorts.,https://i.ytimg.com/vi/TB464lz0zkY/default.jpg,39913,0,8,0,37,en,0,3,3,27,en
1044,1044,44,CyQlOY9YI0s,anime sketch without erasing #asmr #asmrsounds  #sketchanime #shorts #fyp,Join membership to see the earliest videos! https://www.youtube.com/channel/UCNPAJgjON65Fa2-j6hKdI1A/join ❤ ❤Contact ...,https://i.ytimg.com/vi/CyQlOY9YI0s/default.jpg,10208,0,9,5,73,en,2,16,13,120,en
1045,1045,45,z7oG0vUrpBY,IF RICK AND MORTY WAS AN ANIME  - MALEC,"Thank you for watching, hope you enjoyed. See you soon ! Instagram : @malecandco music and mix : KronoMuzik Twitter: ...",https://i.ytimg.com/vi/z7oG0vUrpBY/default.jpg,14156963,0,8,1,39,so,0,17,10,120,en
1046,1046,46,5EN3dO_NTrc,Estafó al chico del Oxxo! 😎. #otakulife #fypシ #oniichan #comedy #humor #anime #oxxo,,https://i.ytimg.com/vi/5EN3dO_NTrc/default.jpg,93189,1,12,9,83,en,0,1,0,3,tl
1047,1047,47,TUVfK8XljbY,Colgate + Anime 📸💥,,https://i.ytimg.com/vi/TUVfK8XljbY/default.jpg,28225204,2,2,1,18,ro,0,1,0,3,tl
1048,1048,48,1inJ_v7KR5o,L&#39;Arbre Généalogique De Zoro Révélé | #shorts #onepiece #anime,Pour me soutenir : ✓ Boutique Amazon : https://amzn.to/3HCAhdD A partir des anime je te fais des vidéos qui vont t'apprendre ...,https://i.ytimg.com/vi/1inJ_v7KR5o/default.jpg,218810,0,10,7,66,fr,0,22,11,128,fr
1049,1049,49,ECE0L7Wq_Ec,Double Life Anime Opening,"Hope I'm not too late to the party! Enjoy! Music: Fate/Apocrypha OP1 - ""Eiyuu Unmei no Uta (英雄 運命の詩)"" - EGOIST - Band ...",https://i.ytimg.com/vi/ECE0L7Wq_Ec/default.jpg,16994,0,4,0,25,en,0,22,15,121,en
1050,1050,0,iJ8ump3BKm0,SNP leader says Nigel Farage and Enoch Powell are influencing Tory anti-refugee policy,Stephen Flynn getting the memo and knocking it out of the park on International Women's Day. #pmqs Follow us on Tik Tok: ...,https://i.ytimg.com/vi/iJ8ump3BKm0/default.jpg,46789,0,14,1,86,en,0,23,7,124,en
1051,1051,1,tTepjckaOT4,"Kamala Harris’ laugh is the ‘biggest, destructive, negative force’ in American politics ever","US Vice President Kamala Harris's laugh is the ""biggest, destructive, negative force"" in American politics ever, according to The ...",https://i.ytimg.com/vi/tTepjckaOT4/default.jpg,8267,0,13,2,92,en,0,20,9,133,en
1052,1052,2,RlfU4DGxIhA,দেয়াল টপকে প্রতিবেশীর বাড়িতে পালালেন ইমরান? | Imran Khan | Pakistan Politics | Somoy TV,imrankhan #pakistanpolitics #somoytv পাকিস্তানের টিভি চ্যানেলে সাবেক ...,https://i.ytimg.com/vi/RlfU4DGxIhA/default.jpg,48305,0,24,4,87,bn,0,18,5,72,bn
1053,1053,3,c5j4XLxfZL0,Bhuma Nagireddy Family May Fade Out From AP Politics | Nidhi Tv,NidhiTv Bhuma Nagireddy Family May Fade Out From AP Politics | Nidhi Tv #bhumamounikareddy #bhumaakhilapriya #YsJagan ...,https://i.ytimg.com/vi/c5j4XLxfZL0/default.jpg,68496,0,11,1,63,en,0,15,7,121,en
1054,1054,4,5hrARClo4ws,Careless Gaetz makes hypothetical worst case real with political stunt,Alex Wagner explains how the sloppy execution of a political stunt by Matt Gaetz resulted in a man accused of murder leading the ...,https://i.ytimg.com/vi/5hrARClo4ws/default.jpg,167202,0,10,0,70,en,0,23,3,132,en
1055,1055,5,tlOw2mfY1mc,Have Christians Confused Politics With the Gospel? with Dr. Michael L. Brown #Podcast  #Shorts,To learn more about Jon McCray go to: https://crossexamined.org/jon-mccray/ To learn more about Melissa Dougherty go to: ...,https://i.ytimg.com/vi/tlOw2mfY1mc/default.jpg,7068,0,14,5,94,en,0,21,12,124,en
1056,1056,6,e_1m_sCzOIw,The wildest political moments of 2021,"From Zoom cat filters to nunchuck demonstrations to Neanderthal caucuses, 2021 got weird. Read more: https://wapo.st/3pvg4gb.",https://i.ytimg.com/vi/e_1m_sCzOIw/default.jpg,130627,0,6,0,37,en,0,19,9,125,en
1057,1057,7,zi7byt4T1xo,‘চড়া মূল্য দিবে সরকার’! কেন একথা বললেন বিএনপির নেতারা? | BNP | Politics |,ভোটের আগে বিএনপিকে মাঠ ছাড়া করতে আবারও মামলা-হামলার পুরানো খেলায় ...,https://i.ytimg.com/vi/zi7byt4T1xo/default.jpg,96306,0,21,5,73,bn,0,25,4,70,bn
1058,1058,8,fgnDltuL4gE,Israel Politics: इजरायल में प्रधानमंत्री Benjamin Netanyahu के खिलाफ विरोध प्रदर्शन जारी,इजरायल (Israel Politics) में प्रधानमंत्री बेंजामिन नेतन्याहू के खिलाफ ...,https://i.ytimg.com/vi/fgnDltuL4gE/default.jpg,40260,0,24,1,88,hi,0,22,5,73,hi
1059,1059,9,nzI14INLyqg,Political Corridor On Sanagareddy Politics | Patnam Manikyam | MLA Jagga Reddy | @SakshiTV,Political Corridor On Sanagareddy Politics | Patnam Manikyam | MLA Jagga Reddy | Sakshi TV #SangareddyPolitics ...,https://i.ytimg.com/vi/nzI14INLyqg/default.jpg,10128,0,11,4,90,en,0,13,7,114,en
1060,1060,10,7jkoRXAiU1w,Why American Politics Has Become So Divided,Why American Politics Has Become So Divided #Shorts #TYT #AnaKasparian #News #Politics #CenkUygur.,https://i.ytimg.com/vi/7jkoRXAiU1w/default.jpg,24683,0,7,0,43,en,0,13,7,98,en
1061,1061,11,Xtf-8XxTzoY,‘দেশে গরম বেশি পড়লেও দোষ আওয়ামী লীগের’ | Politics | News | Ekattor TV,'দেশে গরম বেশি পড়লেও দোষ আওয়ামী লীগের' #banglanews #awamileague #oka #obaidul_quader ...,https://i.ytimg.com/vi/Xtf-8XxTzoY/default.jpg,27298,0,18,3,69,bn,0,19,10,90,bn
1062,1062,12,Z1jTV3bhDL4,Secret congressional codenames revealed,Secret congressional codenames revealed during roll call #shorts #congress #politics #parody #humor #comedy.,https://i.ytimg.com/vi/Z1jTV3bhDL4/default.jpg,3453383,0,4,0,39,en,0,13,7,108,en
1063,1063,13,zbtvYi6v3IE,‘প্রধানমন্ত্রী না থাকায় ফুল দিয়েছেন রাদওয়ান মুজিব; এতে রাজনৈতিক সম্পৃক্ততা নেই’ | Politics,ঐতিহাসিক ৭ মার্চ-এ প্রধানমন্ত্রী শেখ হাসিনার পক্ষে শ্রদ্ধা ...,https://i.ytimg.com/vi/zbtvYi6v3IE/default.jpg,52135,0,33,2,90,bn,0,25,4,62,bn
1064,1064,14,T0OmcGxtcHY,The wildest political moments of 2022,"From gazpacho police to North Korean alliances to ice fishing prostitution, 2022 got weird. Read more: https://wapo.st/3WHdxx4.",https://i.ytimg.com/vi/T0OmcGxtcHY/default.jpg,83643,0,6,0,37,en,0,20,9,127,en
1065,1065,15,34ha-mvGaxs,Bengal Politics: রাজ্য রাজনীতিতে নতুন সমীকরণ ? এক জায়গায় আসছে তৃণমূল বিরোধী শক্তি ?,সাগরদিঘিতে বাম সমর্থিত কংগ্রেস প্রার্থীর জয়ের পর অধীর চৌধুরী ...,https://i.ytimg.com/vi/34ha-mvGaxs/default.jpg,43693,0,26,3,83,bn,0,26,3,65,bn
1066,1066,16,ISkYg00FcQY,UP Politics: गांधी परिवार के खिलाफ पहली बार उम्मीदवार उतारेंगे Akhilesh Yadav?,rahulgandhi #akhileshyadav #soniagandhi #samajwadi #congress #amethi समाजवादी पार्टी अध्यक्ष और ...,https://i.ytimg.com/vi/ISkYg00FcQY/default.jpg,7925,0,23,2,78,hi,0,16,8,99,id
1067,1067,17,63u4AW08OIw,I&#39;m Changing the Way I Think About Politics,"If you don't have your voting plan in order, NOW IS THE TIME: http://www.youtube.com/howtovoteineverystate You can get a ...",https://i.ytimg.com/vi/63u4AW08OIw/default.jpg,372128,0,10,3,47,en,0,23,12,124,en
1068,1068,18,mM-CWvpD6i8,প্রধানমন্ত্রীকে নিয়ে বিকৃত স্লোগান দেয়ায় খেপলেন শামীম ওসমান | Shamim Osman | Politics | Awami League,shamimosman #awamileague #politics #somoytv আরও বিস্তারিত জানতে ভিজিট করুন: ...,https://i.ytimg.com/vi/mM-CWvpD6i8/default.jpg,122523,0,31,3,100,bn,0,17,7,79,bn
1069,1069,19,CikhAbhBI3I,Political Candidates Turn To TikTok To Mobilize Younger Voters,"In Florida, some candidates running for office are using TikTok as a new campaigning tool in hopes to connect with a younger ...",https://i.ytimg.com/vi/CikhAbhBI3I/default.jpg,3234,0,9,0,62,en,0,22,4,128,en
1070,1070,20,QZ3r15ndHiQ,First lady Dr. Jill Biden calls mental competency tests for politicians ‘ridiculous’ #shorts,First Lady Dr. Jill Biden dismisses the mental competency test proposal that was suggested by Republican presidential candidate ...,https://i.ytimg.com/vi/QZ3r15ndHiQ/default.jpg,27827,0,13,2,92,en,0,18,4,131,en
1071,1071,21,H9iXQUlV31U,Shady Politics: Vote Derrick Barry | S8 E7 | RuPaul&#39;s Drag Race,Presidential hopeful Derrick Barry is looking to swing your vote her way. Vote Derrick Barry. #LogoTV #DragRace More from ...,https://i.ytimg.com/vi/H9iXQUlV31U/default.jpg,422429,0,12,6,67,en,0,19,7,125,en
1072,1072,22,lnxVDDaZQxM,Wenger: Politics hurt World Cup performance | Al Jazeera Newsfeed,Former football manager Arsene Wenger has criticised World Cup teams who were focused on “political demonstrations” instead ...,https://i.ytimg.com/vi/lnxVDDaZQxM/default.jpg,32112,0,9,2,65,en,0,17,3,127,en
1073,1073,23,GGxEyIaoq60,"Myanmar politics, explained","Myanmar's first democratically elected parliament will be in session from the 1st of February, 2016. But Aung San Suu Kyi, the ...",https://i.ytimg.com/vi/GGxEyIaoq60/default.jpg,24837,0,3,1,27,en,0,22,7,130,en
1074,1074,24,8XtAwARcYl4,#Latina #comedian on politics and culture,"In her new HBO Max comedy special, ""Aida Rodriguez Fighting Words,"" Rodriguez shows how comedy and politics opens up ...",https://i.ytimg.com/vi/8XtAwARcYl4/default.jpg,5741,0,6,2,41,en,0,19,7,120,en
1075,1075,25,zIzs9BTzyOY,‘সরকারের ব্যর্থতায় ঢাকা বিস্ফোরণের নগরীতে পরিণত হয়েছে’ | BNP | Politics | Jamuna TV,সরকারের ব্যর্থতায় ঢাকা এখন বিস্ফোরণের নগরীতে পরিণত হয়েছে বলে ...,https://i.ytimg.com/vi/zIzs9BTzyOY/default.jpg,14431,0,24,3,83,bn,0,22,3,66,bn
1076,1076,26,Bp80Re4IHn8,MTP Compressed: &#39;People Have To Just Take The Heat Down&#39; Over Politics,Sen. Amy Klobuchar (D-Minn.) joins “Meet the Press” to discuss the increase in threats of political violence following the attack on ...,https://i.ytimg.com/vi/Bp80Re4IHn8/default.jpg,10327,0,14,7,78,en,0,22,8,136,en
1077,1077,27,0WMsMfJ_GTo,The Time for Politics,"Thinking about saying these things into a camera was overwhelming me, so I just said them into my microphone, I hope that's OK.",https://i.ytimg.com/vi/0WMsMfJ_GTo/default.jpg,219690,0,4,0,21,en,0,24,4,127,en
1078,1078,28,-Z7YHGOR1Ws,UP Politics: Congress या BSP...किसके साथ जाएंगे OP Rajbhar? Mayawati। BJP। Mission 2024। Latest News,UP Politics: Congress या BSP...किसके साथ जाएंगे OP Rajbhar? Mayawati। BJP। Mission 2024। Latest News ...,https://i.ytimg.com/vi/-Z7YHGOR1Ws/default.jpg,29344,0,20,5,100,en,0,20,8,104,en
1079,1079,29,2-YKc-YyxtY,"Veteran politician in Malaysia, Mahathir Mohamad returns to politics at 97 | WION","A veteran politician in Malaysia, Mahathir Mohamad, at the age of 97 has now decided to contest elections again. He'll be taking ...",https://i.ytimg.com/vi/2-YKc-YyxtY/default.jpg,8241,0,12,2,81,en,0,23,7,132,en
1080,1080,30,s06w_9DeK0I,US politics in 2022 | A year in review,"This year's most significant political event in the US was the midterm elections. But for the Republicans, things didn't quite go to ...",https://i.ytimg.com/vi/s06w_9DeK0I/default.jpg,1029,0,8,1,38,en,0,24,7,136,en
1081,1081,31,CFEAcWw951A,Chilakaluripet TDP Leaders Warns Chandrababu | Prathipati Pulla Rao | Political Corridor @SakshiTV,Chilakaluripet TDP Leaders Warns Chandrababu | Prathipati Pulla Rao | Political Corridor @SakshiTV ​ #chilakaluripet #tdp ...,https://i.ytimg.com/vi/CFEAcWw951A/default.jpg,76535,0,11,3,98,en,0,13,8,125,en
1082,1082,32,c-evgPk7RmY,Lewis Black&#39;s Rantcast - Florida Politics,Move to Florida for the weather. Stay in spite of the vibe! https://thelaughbutton.podlink.to/Rantcast For advertising opportunities ...,https://i.ytimg.com/vi/c-evgPk7RmY/default.jpg,21235,0,7,4,45,en,0,20,11,136,en
1083,1083,33,OSnys1IDNHU,The Crown Season 2 | Trailer: Politics | Netflix,"With the world undergoing great changes, a damaged British monarchy must confront its past in order to have a future. The Crown ...",https://i.ytimg.com/vi/OSnys1IDNHU/default.jpg,111828,0,7,3,48,en,0,22,5,131,en
1084,1084,34,M9uMJQg_HuA,Politics dampen enthusiasm for FIFA World Cup in Qatar,The Canadian men's national soccer team is days away from kicking off its first FIFA World Cup match since 1986. However ...,https://i.ytimg.com/vi/M9uMJQg_HuA/default.jpg,2790,0,9,0,54,en,0,22,5,124,en
1085,1085,35,feFnET2BRjU,MISSIO - P.O.L.I.T.I.C.S. (Audio),Get The New Album 'The Darker The Weather // The Better The Man' feat. “I See You” & “Rad Drugz” Available Now: ...,https://i.ytimg.com/vi/feFnET2BRjU/default.jpg,586427,0,10,11,33,it,0,20,10,115,en
1086,1086,36,Si1lxcwJqI0,Funny Or Die Presents: Playground Politics - Africa (HBO),"Subscribe to HBO: http://itsh.bo/10qIqsj If you have natural resources, then you'll receive food. HBO on Facebook: ...",https://i.ytimg.com/vi/Si1lxcwJqI0/default.jpg,371277,0,8,4,57,en,0,20,13,118,en
1087,1087,37,4svp8KgBeTk,Dominic Fike - Politics &amp; Violence (Lyrics),Dominic Fike Politics & Violence lyrics video. Dominic Fike Politics and Violence lyrics! Listen to our Top Pop Music Hits ...,https://i.ytimg.com/vi/4svp8KgBeTk/default.jpg,45630,0,6,5,47,en,0,19,6,126,en
1088,1088,38,rqLj6PPYH9g,Ivanka Trump Takes a Step Back From Politics,"Donald Trump's daughter Ivanka was missing in action as he announced his third bid for president. In a statement, she says ""I do ...",https://i.ytimg.com/vi/rqLj6PPYH9g/default.jpg,69822,0,8,0,44,en,0,24,7,132,en
1089,1089,39,-LDtuVBQKKY,New Political Party In Telangana? : తెలంగాణలో కొత్త పార్టీ? నాయకులెవరు? - TV9,Watch LIVE: https://goo.gl/w3aQde తాజా వార్తల కోసం : https://tv9telugu.com/ ▻TV9 LIVE : https://bit.ly/2FJGPps ...,https://i.ytimg.com/vi/-LDtuVBQKKY/default.jpg,36370,0,20,5,77,te,0,22,21,114,te
1090,1090,40,OYFy4R8BxiM,Crying Japanese politician Ryutaro Nonomura is an internet hit - BBC News,Subscribe to BBC News www.youtube.com/bbcnews A video clip of Japanese politician Ryutaro Nonomura crying at a press ...,https://i.ytimg.com/vi/OYFy4R8BxiM/default.jpg,627076,0,11,1,73,en,0,20,6,120,en
1091,1091,41,FXoAo_HTDCA,Former Pakistan PM Imran Khan faces politics ban over gifts case | Latest English News | WION,Former Pakistan prime minister Imran Khan could be barred from political office Friday when the election commission rules on ...,https://i.ytimg.com/vi/FXoAo_HTDCA/default.jpg,17807,0,15,2,93,en,0,19,3,128,en
1092,1092,42,8zuWZCvdIvw,"Lies, Politics and Democracy | FIRST LOOK | FRONTLINE PBS","First look at the opening scene of FRONTLINE's ""Lies, Politics and Democracy."" This journalism is made possible by viewers like ...",https://i.ytimg.com/vi/8zuWZCvdIvw/default.jpg,50243,0,8,3,57,en,0,21,8,131,en
1093,1093,43,5ZCN4LaxpJI,Shivsena Politics |  मुंबईमध्ये शिवसेना आणि ठाकरे गटामध्ये पोस्टर वॉर,UddhavThackeray #ShivSena #ShivSenaCrisis #ShivSenaBhavan #ThackerayCamp https://www.tv9marathi.com is a 24/7 ...,https://i.ytimg.com/vi/5ZCN4LaxpJI/default.jpg,52761,0,19,1,69,mr,0,13,13,113,en
1094,1094,44,BkuF1wz6bX8,Deadly clashes in Iraq as Sadr quits politics,"Heavy clashes erupted in Baghdad, killing almost 20 people, after powerful Shi'ite cleric Moqtada al-Sadr said he would quit ...",https://i.ytimg.com/vi/BkuF1wz6bX8/default.jpg,83247,0,8,0,45,en,0,21,7,128,en
1095,1095,45,DRUEHfxOkhE,North Korea Politics: क्या भाई के बाद बहन Kim Yo-jong को भी मरवा देंगे तानाशाह Kim Jong Un | #TV9D,उत्तर कोरिया के सुप्रीम लीडर किम जोंग उन की पत्नी और उनकी बहन के बीच ...,https://i.ytimg.com/vi/DRUEHfxOkhE/default.jpg,7489,0,27,4,98,hi,0,26,3,72,hi
1096,1096,46,AquJ0ICKimU,Jimmy Talks to Kids - Politics,SUBSCRIBE to get the latest #KIMMEL: http://bit.ly/JKLSubscribe Watch the latest Mean Tweets: http://bit.ly/MeanTweets8 ...,https://i.ytimg.com/vi/AquJ0ICKimU/default.jpg,5558594,0,5,1,30,en,0,19,16,123,en
1097,1097,47,lRzH_McDzxA,Texas politicians react to President Joe Biden&#39;s State of the Union address | KVUE,"After President Biden's State of the Union address, multiple Texas politicians have spoken out on social media. STORY: ...",https://i.ytimg.com/vi/lRzH_McDzxA/default.jpg,747677,0,15,4,86,en,0,19,7,122,en
1098,1098,48,GyxSuHRN_ZY,Bulgaria politics: No clear path to form government,Bulgaria's fourth election in two years looks to have brought back former prime minister Boyko Borissov. But it is forcing some ...,https://i.ytimg.com/vi/GyxSuHRN_ZY/default.jpg,3608,0,8,1,51,en,0,22,5,131,en
1099,1099,49,YBy6Fnyss4c,Political Musical - SNL,Off-Broadway musical Divided We Stand dives head first into the current political climate. #SNL #SNL44 #JonahHill ...,https://i.ytimg.com/vi/YBy6Fnyss4c/default.jpg,2396900,0,3,1,23,it,0,17,8,117,en
1100,1100,0,sABEWA-4kUc,Watch Host&#39;s Reaction When His Question Blows Up In His Face | DM CLIPS | Rubin Report,Dave Rubin of “The Rubin Report” shares a clip of “Meet the Press'” Chuck Todd regretting asking Chris Sununu about Fox News' ...,https://i.ytimg.com/vi/sABEWA-4kUc/default.jpg,518464,0,17,5,90,en,0,22,5,129,en
1101,1101,1,fLhMoxMWHho,How Did Will Smith React To Chris Rock&#39;s Netflix Special?,"Chris Rock didn't pull any punches on Will Smith in his new Netflix special, and those repeated blows reportedly have Smith's ...",https://i.ytimg.com/vi/fLhMoxMWHho/default.jpg,15329,0,12,4,61,en,0,23,6,129,en
1102,1102,2,gHNBKnz3ScQ,See McConnell&#39;s reaction to Tucker Carlson&#39;s Fox News segment,Fox News host Tucker Carlson is facing blow back from Republican leaders for peddling new falsehoods about the January 6 ...,https://i.ytimg.com/vi/gHNBKnz3ScQ/default.jpg,14807,0,13,6,69,en,0,20,3,124,en
1103,1103,3,IXFbe1CiCsk,7-0! Liverpool vs Man Utd - Football Reacts!,The cartoon highlights: https://youtu.be/6TTRPv2bhYk ⚽️ Subscribe to 442oons: http://bit.ly/442oonsSUB ⚽️ Business ...,https://i.ytimg.com/vi/IXFbe1CiCsk/default.jpg,429235,0,8,4,44,en,2,15,15,118,en
1104,1104,4,SGpBmfzIbZA,Aidan Bryant&#39;s emotional reaction to winning 🥺,Aidan Bryant had all the feels when he won America's Got Talent: All-Stars! » Get The America's Got Talent App: ...,https://i.ytimg.com/vi/SGpBmfzIbZA/default.jpg,13427,1,8,3,50,en,0,22,9,115,en
1105,1105,5,OOU58rHmwnU,Scream VI | Final Trailer | Reaction!,Watch Tyrone Magnus's Scream VI | Final Trailer | Reaction! Become a Super Magnusite and watch all of my copyright claimed ...,https://i.ytimg.com/vi/OOU58rHmwnU/default.jpg,10003,0,5,3,37,en,0,20,7,126,en
1106,1106,6,Xn3p286RNK8,How Will Smith Feels About Chris Rock&#39;s Comedy Special (Source),"A source tells ET that Will Smith is 'embarrassed and hurt' by Chris Rock's Netflix comedy special, 'Selective Outrage.' The live ...",https://i.ytimg.com/vi/Xn3p286RNK8/default.jpg,1875312,0,12,5,67,en,0,22,10,133,en
1107,1107,7,NUPbzDFufCQ,Liverpool 7-0 Man United GOAL REACTIONS,ORIGINAL VIDEO: https://www.youtube.com/live/Kmyi0E8WGAc?feature=share SUBSCRIBE TO DR SPORTS: ...,https://i.ytimg.com/vi/NUPbzDFufCQ/default.jpg,169702,0,7,1,39,en,0,14,14,98,de
1108,1108,8,w9S7jpjcOBs,Alisha Weir&#39;s reaction to learning she got the part of Matilda 🥹 #shorts,"SUBSCRIBE: https://bit.ly/2ZflIEC About Netflix After School: Welcome to the official Netflix After School channel, where you can ...",https://i.ytimg.com/vi/w9S7jpjcOBs/default.jpg,1301697,1,14,4,76,en,0,20,11,133,en
1109,1109,9,KNPF-gA-OBs,TMNT MUTANT MAYHEM TRAILER REACTION | Teenage Mutant Ninja Turtles Mutant Mayhem Teaser Trailer,Teenage Mutant Ninja Turtles Mutant Mayhem Teaser Trailer: https://youtu.be/ooZdaF2zMlM Subscribe!,https://i.ytimg.com/vi/KNPF-gA-OBs/default.jpg,74275,0,13,1,95,en,0,13,7,98,en
1110,1110,10,-ObcL0qPfUk,Dragon Ball Z Budokai Tenkaichi 4 Trailer Reaction,Dragon Ball Z Budokai Tenkaichi 4 is REAL and it was just announced at Dragon Ball Z Battle Hour! Watch me react to the DBZ ...,https://i.ytimg.com/vi/-ObcL0qPfUk/default.jpg,97528,0,8,0,50,en,0,25,4,127,en
1111,1111,11,RxZChG9uNz8,Comparison: What If USA Died (Reaction From Different Countries),This Video Show What If USA Died (Reaction From Different Countries) Subscribe For More Interesting Videos! countries reaction ...,https://i.ytimg.com/vi/RxZChG9uNz8/default.jpg,515076,0,9,3,64,en,0,18,6,130,en
1112,1112,12,eiLG3qEtiLs,MAX VERSTAPPEN DOES REACTION SPEED TEST🚦😳  Who Will Win?,Jeremy Lynch vs Max Verstappen Let's see who comes out on top in this reaction speed test: Me versus Formula One world ...,https://i.ytimg.com/vi/eiLG3qEtiLs/default.jpg,109371,2,9,1,56,en,0,23,5,122,en
1113,1113,13,wESIHn7oC_o,Teenage Mutant Ninja Turtles: Mutant Mayhem | Teaser Trailer (2023 Movie) - Reaction!,Watch Tyrone Magnus's Teenage Mutant Ninja Turtles: Mutant Mayhem | Teaser Trailer (2023 Movie) - Seth Rogen - Reaction!,https://i.ytimg.com/vi/wESIHn7oC_o/default.jpg,55838,0,11,6,85,en,0,17,8,120,en
1114,1114,14,Dfke2CMPCXw,funny😎👿😱.......| reaction | #funny #shorts #youtubeshorts #viral,funny      .......| reaction | #funny #shorts #youtubeshorts #viral #short #music #comedy #tiktok #shortsfee.,https://i.ytimg.com/vi/Dfke2CMPCXw/default.jpg,3735739,3,6,13,64,en,0,11,19,109,en
1115,1115,15,gezmVR__RG8,Girls😍 reaction🔥 #shorts #reaction,,https://i.ytimg.com/vi/gezmVR__RG8/default.jpg,2332058,2,4,2,34,en,0,1,0,3,tl
