,Unnamed: 0,Unnamed: 0.1,vid,title,description,thumbnail,view_counts,t_emoji_count,t_word_count,t_punctuation_count,t_length,t_lang,d_emoji_count,d_word_count,d_punctuation_count,d_length,d_lang
722,722,22,ZuF54KslqZg,Unboxing My New Kindle,,https://i.ytimg.com/vi/ZuF54KslqZg/default.jpg,295741,0,4,0,22,en,0,1,0,3,tl
723,723,23,ABm7Xsxkirw,unboxing my new iMac 🤭🤍 #apple #imac #technology #shorts,,https://i.ytimg.com/vi/ABm7Xsxkirw/default.jpg,5122322,2,8,4,56,en,0,1,0,3,tl
724,724,24,Kpu0biagbFg,Air Jordan 5 UNC Unboxing,These are now officially live and can be picked up! Let us show you a couple details of the sneaker before you grab your pair and ...,https://i.ytimg.com/vi/Kpu0biagbFg/default.jpg,7522,0,5,0,25,en,0,26,4,133,en
725,725,25,uVmU-Qs68GA,Rush - Signals (40th Anniversary) Unboxing Video,The 'Signals' Super Deluxe celebrates 40 years with new Hugh Syme artwork throughout & the 2015 remaster on CD for the first ...,https://i.ytimg.com/vi/uVmU-Qs68GA/default.jpg,38106,0,6,3,48,en,0,21,6,128,en
726,726,26,J3NTJ0V7qTU,UNBOXING BOX BERHADIAH POP MART SKULL PANDA VIRAL !,Pop Mart Skullpanda The Mare of Animals Series Pop Mart: @POPMARTOFFICIAL Bianca Kartika: @BiancaKartika TikTok: ...,https://i.ytimg.com/vi/J3NTJ0V7qTU/default.jpg,482035,0,8,1,51,de,0,15,8,116,id
727,727,27,HTegXL38ROA,Unboxing Blindbox Disney Princess Miniso 300ribu | Asakecil,,https://i.ytimg.com/vi/HTegXL38ROA/default.jpg,507414,0,7,1,59,en,0,1,0,3,tl
728,728,28,V-wRuNZEfWs,BRATZ Mini Makeup Unboxing Satisfying Video ASMR! #shorts #asmr,Loving These Bratz Mini Comsetics that are Actally REAL Makeup! #shorts #asmr #asmrmakeup #mini.,https://i.ytimg.com/vi/V-wRuNZEfWs/default.jpg,12676257,0,9,3,63,en,0,14,6,96,en
729,729,29,GVfuVJ0ce_g,ASMR Unboxing Cute Unicorn Stationery Set ✏️🦄 💜,Today i'll be unboxing a unicorn stationery set that i've bought recently. Hope this asmr unboxing of this cute stationery set will ...,https://i.ytimg.com/vi/GVfuVJ0ce_g/default.jpg,4819658,3,6,0,47,en,0,24,6,135,en
730,730,30,LdeuKpLtbcc,Unboxing The Smallest Toy from MICRO TOY BOX #shorts,"First time opening these, and I was pleasantly surprised by how small and functional one of them is. #shorts.",https://i.ytimg.com/vi/LdeuKpLtbcc/default.jpg,873631,0,9,1,52,en,0,19,4,109,en
731,731,31,gd3ozVg7FmM,Unboxing the AIR JORDAN 1 LOST &amp; FOUND Chicago 2022,,https://i.ytimg.com/vi/gd3ozVg7FmM/default.jpg,736408,0,10,2,55,en,0,1,0,3,tl
732,732,32,lhJ5mNzEZiM,0525304827#cute fan#buy i phone#unboxing#Abdul Ghafoor#Abdul shakoor#Zam Zam electronics shop,,https://i.ytimg.com/vi/lhJ5mNzEZiM/default.jpg,477919,0,15,6,93,en,0,1,0,3,tl
733,733,33,yGyisipwRPE,Iphone 13 Pink 128GB Aesthetic Unboxing,"So happy, finally i got my self an Iphone 13 as a self reward!!",https://i.ytimg.com/vi/yGyisipwRPE/default.jpg,2055512,0,6,0,39,en,0,14,3,63,en
734,734,34,VWB0C5DHNXc,Unboxing Urbanic Bag 😱 #crafteraditi #youtubepartner #shorts #youtubeshorts #unboxing @CrafterAditi,This is your Crafter Aditi's 2nd Channel Instagram : @crafter_aditi https://instagram.com/crafter_aditi/ Guys and Cuties I ...,https://i.ytimg.com/vi/VWB0C5DHNXc/default.jpg,3295300,1,9,6,99,en,0,18,14,126,en
735,735,35,Vr-zsiwXxg0,Metroid Prime Remastered - Shorts Unboxing,Metroid Prime Remastered is finally here and today I wanted to do an unboxing to show what's inside.,https://i.ytimg.com/vi/Vr-zsiwXxg0/default.jpg,31170,0,5,1,42,en,0,19,2,100,en
736,736,36,pEmnaiQ-5Cc,A capo del globo UNBOXING💖😱🫶🏻 #unboxing #mollette #acapodelglobo #gadget,,https://i.ytimg.com/vi/pEmnaiQ-5Cc/default.jpg,258143,3,9,4,72,it,0,1,0,3,tl
737,737,37,M0F4R89r9kw,Mystery Sensory Sushi Fidget Unboxing Satisfying Video ASMR! #shorts #fidgets #asmr,Let's Open this Mystery Fidget Sensory Sushi Pack and See What We Find! #shorts #fidgets #asmr #popits #oddlysatisfying.,https://i.ytimg.com/vi/M0F4R89r9kw/default.jpg,1735783,0,11,4,83,en,0,19,8,120,en
738,738,38,nFpohZInJ8o,Humari Abtak Ki Sabse Fast Unboxing Feat. Samsung Galaxy F13⚡️#TrakinShorts #Shorts,Doston welcome to the world of Trakin Shorts. Yaha aap ko dekhne milenge bahot saare interesting videos to jaldi se subscribe ...,https://i.ytimg.com/vi/nFpohZInJ8o/default.jpg,900080,1,12,3,83,en,0,21,4,129,en
739,739,39,yycvJQ8tBkc,iPhone 14 Pro Max Unboxing - Itna Sasta Flipkart Sale me - Rv #shorts,shorts.,https://i.ytimg.com/vi/yycvJQ8tBkc/default.jpg,22359,0,12,3,69,en,0,1,1,7,en
740,740,40,vz6g4qi99QY,I got my first LOUIS VUITTON *Unboxing* #shorts #youtubeshorts #ashortaday #minivlog #unboxing #yt,buying my first LOUIS VUITTON *Unboxing* #shorts #youtubeshorts #ashortaday #minivlog #unboxing #yt.,https://i.ytimg.com/vi/vz6g4qi99QY/default.jpg,1963417,0,13,8,98,en,0,12,9,100,en
741,741,41,7PxxVaqRzdA,UNBOXING IPHONE 14 PRO DEEP PURPLE | KAWAII AESTHETIC | HILDAXKEIKO #shorts,SUBSCRIBE: http://bit.ly/SubsKeikoFamily Follow Tiktok : https://www.tiktok.com/@hildaxkeiko?_t=8WD8ozCzY7K&_r=1 Follow ...,https://i.ytimg.com/vi/7PxxVaqRzdA/default.jpg,950037,0,10,3,75,en,0,17,23,123,pl
742,742,42,wv4e1FWjyAE,ASMR Unboxing @NIIMBOT D11 Label Maker #shorts #asmr #unboxing,Shop it here: https://niimbots.com/?ref=THECRAFTYLEFTY 15% discount code: THECRAFTYLEFTY For business inquiries: ...,https://i.ytimg.com/vi/wv4e1FWjyAE/default.jpg,9546476,0,9,4,62,en,0,15,14,116,en
743,743,43,ZJkzcDgZgiQ,Unboxing Samsung Galaxy Z Flip 4,capitalism popped off today! but i finally got my cute little dream phone #galaxyzflip4 #samsung #technology #unboxing.,https://i.ytimg.com/vi/ZJkzcDgZgiQ/default.jpg,2695627,0,6,0,32,tl,0,17,6,119,en
744,744,44,SysLiiRBwIM,HUGE SHOPPING SPREE UNBOXING HAUL #shorts #shopping #haul,,https://i.ytimg.com/vi/SysLiiRBwIM/default.jpg,51885,0,8,3,57,en,0,1,0,3,tl
745,745,45,4j_J6h_HkI4,"Unboxing My New $10,000 Gecko! *CRAZY* #shorts #animals #lizard #reptiles #gecko #rare #cuteanimals",,https://i.ytimg.com/vi/4j_J6h_HkI4/default.jpg,180305,0,14,12,99,en,0,1,0,3,tl
746,746,46,PymTr0KZvYA,"Unboxing the Air Jordan 1 &quot;YEAR OF THE RABBITS&quot;, are these the best to release in 2023!? #shorts",,https://i.ytimg.com/vi/PymTr0KZvYA/default.jpg,75836,0,20,8,106,en,0,1,0,3,tl
747,747,47,_Zj1C0Ik87I,Daredevil Unboxing! #iosonounvirtuale #daredevil #xmstudios #unboxing #marvel #marvelcomics,,https://i.ytimg.com/vi/_Zj1C0Ik87I/default.jpg,193246,0,8,7,91,en,0,1,0,3,tl
748,748,48,ImjUUw-UQ8I,ABRINDO LOL SURPRISE GLITTER GLOBE !! #lolsurprise #unboxing #toys,,https://i.ytimg.com/vi/ImjUUw-UQ8I/default.jpg,12722,0,8,5,66,en,0,1,0,3,tl
749,749,49,AXWprRYcR8g,Unboxing Blindbox KKV 500ribu | Asakecil,,https://i.ytimg.com/vi/AXWprRYcR8g/default.jpg,153146,0,5,1,40,en,0,1,0,3,tl
750,750,0,7G250W24xi4,The Most Awkward AA Meeting Ever. Louis Smith,The most awkward AA meeting ever might be the one Louis Smith had to attend with his dad. In this clip from his first ever Dry Bar ...,https://i.ytimg.com/vi/7G250W24xi4/default.jpg,30048,0,8,1,45,en,0,27,4,134,en
751,751,1,Xn3p286RNK8,How Will Smith Feels About Chris Rock&#39;s Comedy Special (Source),"A source tells ET that Will Smith is 'embarrassed and hurt' by Chris Rock's Netflix comedy special, 'Selective Outrage.' The live ...",https://i.ytimg.com/vi/Xn3p286RNK8/default.jpg,1857386,0,12,5,67,en,0,22,10,133,en
752,752,2,YZrErQfqVjE,COMEDY,Laugh with us - Comedian: @ZACHxFULLER Music: @Ockeroid / @OckeroidMusic Music- https://youtu.be/zEQWcmDysGw ...,https://i.ytimg.com/vi/YZrErQfqVjE/default.jpg,13966966,0,1,0,6,en,0,13,16,112,en
753,753,3,f5rJbZFnxVg,You&#39;re His Wife? | The Big Bang Theory | Comedy Central Africa,The Penny-and-Leonard duo has fans at an autograph signing questioning it's legitimacy | The Big Bang Theory on Comedy ...,https://i.ytimg.com/vi/f5rJbZFnxVg/default.jpg,45705,0,12,6,66,en,0,21,7,122,en
754,754,4,RB3Nkf-CW50,#mercuri_88 #shorts The Master - Mother #funny #comedy #master,,https://i.ytimg.com/vi/RB3Nkf-CW50/default.jpg,101607,0,8,7,62,en,0,1,0,3,tl
755,755,5,13w0XXh0l4k,Chris Rock addresses Will Smith Oscars slap in new Netflix comedy special,"Almost a year after the comedian was assaulted on stage at the 2022 Academy Awards, Rock finally talked about the infamous ...",https://i.ytimg.com/vi/13w0XXh0l4k/default.jpg,599638,0,12,0,73,en,0,21,4,126,en
756,756,6,pB1LSZsZ0WA,The Comedy Store Watch Party | Chris Rock: Selective Outrage | Netflix,"Subscribe: https://bit.ly/2Kncxw6 About Netflix Is A Joke: The official hub of Netflix stand-up, comedy series, films, and all things ...",https://i.ytimg.com/vi/pB1LSZsZ0WA/default.jpg,7408,0,10,3,70,en,0,23,14,137,en
757,757,7,szzsf5lPs0g,Living With Sheldon | The Big Bang Theory | Comedy Central Africa,"Sheldon and Amy become lab rats, treating living together as a science experiment | The Big Bang Theory on Comedy Central, ...",https://i.ytimg.com/vi/szzsf5lPs0g/default.jpg,72903,0,10,2,65,en,0,20,6,126,en
758,758,8,_8v3CjhliZo,Happy Holi 🤪😜 by Upboyraj @YouTube #funny #viral #comedy #trending #youtube #LetsPlayHoli #holi,,https://i.ytimg.com/vi/_8v3CjhliZo/default.jpg,600239,2,12,8,95,en,0,1,0,3,tl
759,759,9,mYtl-472gG0,Comedy - Gen Hoshino [星野源「喜劇」] Lyrics Video (Kan/Rom/Eng),喜劇 #SPYxFAMILY #Comedy #星野源 #星野源 We do not own the MUSIC. All rights reserved to the original owner. •Artist: 星野源 ...,https://i.ytimg.com/vi/mYtl-472gG0/default.jpg,496128,0,10,7,57,en,0,20,10,117,en
760,760,10,1XjP2nKEJtc,Grocery Store Lines | Ali Siddiq Stand Up Comedy,Y'all Don't Know How to Stand in Lines! Check out tour dates: https://www.alisiddiq.com/ Connect on social media! Instagram: ...,https://i.ytimg.com/vi/1XjP2nKEJtc/default.jpg,58945,0,8,1,48,en,0,23,15,128,en
761,761,11,CmXiI38YvE8,When Dad Came to Visit | Ali Siddiq Stand Up Comedy,Out of all the things to say... Check out tour dates: https://www.alisiddiq.com/ Connect on social media! Instagram: ...,https://i.ytimg.com/vi/CmXiI38YvE8/default.jpg,92539,0,10,1,51,en,0,20,15,120,en
762,762,12,zj8WIjHTwh4,#comedy #relatable #relationship,,https://i.ytimg.com/vi/zj8WIjHTwh4/default.jpg,20185,0,3,3,32,en,0,1,0,3,tl
763,763,13,joMMiJBjqI4,A smart mother quickly discovers her son&#39;s secret!#funny #comedy,"Hey! I'm super talented GuiGe, this is my Only Official Channel on YouTube.   I made super creative funny videos with my family!",https://i.ytimg.com/vi/joMMiJBjqI4/default.jpg,14115,0,12,6,68,en,0,23,5,128,en
764,764,14,vQurBxGkQk4,we asked 100 closet r@cists #shorts #comedy #funny,,https://i.ytimg.com/vi/vQurBxGkQk4/default.jpg,522386,0,9,4,50,en,0,1,0,3,tl
765,765,15,TWnI4cVrQxM,Cancel Comedy now!,shorts.,https://i.ytimg.com/vi/TWnI4cVrQxM/default.jpg,44909,0,3,1,18,en,0,1,1,7,en
766,766,16,H6iGeBOnppI,An Arm &amp; Two Hands | Ali Siddiq Stand Up Comedy,The lengths I need to go to give myself space... Check out tour dates: https://www.alisiddiq.com/ Connect on social media!,https://i.ytimg.com/vi/H6iGeBOnppI/default.jpg,103122,0,10,3,51,en,0,22,11,122,en
767,767,17,2ZTCBL7N6rI,Big Box Stores Are The Absolute Worst. Matin Atrushi,"Big box stores are the absolute worst, or at least thats the vibe you get from Matin Atrushi in this clip from his first ever Dry Bar ...",https://i.ytimg.com/vi/2ZTCBL7N6rI/default.jpg,33350,0,9,1,52,en,0,27,4,137,en
768,768,18,NU4kcJztSCI,“Autism” 🎤: Kiry Shabazz - #comedy #kiryshabazz #donttellcomedy #shorts,Subscribe to our channel and check out the full set from Kiry Shabazz! http://bit.ly/dtcyoutube Get on our secret email list at the ...,https://i.ytimg.com/vi/NU4kcJztSCI/default.jpg,11842624,1,7,6,71,en,0,25,9,135,en
769,769,19,rjlYf23oZyE,Cashing in DUI #shorts #comedy #funny,that's not how that works #shorts #comedy #funny #jokes #podcast #crowdwork #standup #safety #driving #car #auto #liquor ...,https://i.ytimg.com/vi/rjlYf23oZyE/default.jpg,91934,0,6,3,37,en,0,18,16,124,en
770,770,20,hY3wmk-TrZo,Sheldon Hosts Brunch | The Big Bang Theory | Comedy Central Africa,Sheldon's not great at surprises but him hosting brunch has Amy a little confused considering there might be a Romanian lady ...,https://i.ytimg.com/vi/hY3wmk-TrZo/default.jpg,24679,0,10,2,66,en,0,22,4,128,en
771,771,21,G3qQtf7jahE,「SPY×FAMILY」Ending → Comedy/喜劇 by Gen Hoshino | Lyrics,Anime→ Spy X Family ♪Song→ Comedy ♪Album→ Comedy ♪Artist→ Gen Hoshino ♪Vocal→ Gen Hoshino ♪Lyricist→ Gen ...,https://i.ytimg.com/vi/G3qQtf7jahE/default.jpg,4189697,0,9,2,54,en,0,16,3,108,en
772,772,22,fgwvQZli1Is,எத்தன நாளாடா உனக்கு இந்த கெட்டபழக்கம்.? 🤣🤣 #shorts #comedy // Troll Boy Karan,Thanks for watching Please Help To our Channel: Gpay : 9688618933 UPI= trollboykaran@apl Like Share Comment ...,https://i.ytimg.com/vi/fgwvQZli1Is/default.jpg,490651,2,18,6,77,ta,0,16,7,111,en
773,773,23,61QTuEN7hNg,when a feminist gets to heaven #shorts #comedy #funny,,https://i.ytimg.com/vi/61QTuEN7hNg/default.jpg,527233,0,9,3,53,en,0,1,0,3,tl
774,774,24,t8pGN-57sTY,Part-2 ഭൂതശക്തി വന്നില്ല😫ആശാനും ഉസ്മാനും പോക്കരേം അയ്മുട്ടിനേം ഇടിച്ച് വീഴ്ത്തി😂#comedy #fun,,https://i.ytimg.com/vi/t8pGN-57sTY/default.jpg,6868,2,30,3,92,ml,0,1,0,3,tl
775,775,25,LrYYVQC_9mk,Jordan Peterson #shorts #comedy #funny,maybe he got fat because he's not making his bed often enough #shorts #comedy #funny #jokes #standup #crowdwork ...,https://i.ytimg.com/vi/LrYYVQC_9mk/default.jpg,151797,0,5,3,38,en,0,19,10,115,en
776,776,26,rygakgVt_Mw,Happy Holi😍😂 #comedy #chetanmonga #shorts,,https://i.ytimg.com/vi/rygakgVt_Mw/default.jpg,341527,2,5,3,41,en,0,1,0,3,tl
777,777,27,Iu9FeuQQqPo,Lift- Stand Up Comedy By Anubhav Singh Bassi,"Here are a few more glimpses from my Stand Up Comedy Special ""Bas Kar Bassi”. You can watch the complete show on Amazon ...",https://i.ytimg.com/vi/Iu9FeuQQqPo/default.jpg,2961219,0,8,1,44,en,0,23,5,123,en
778,778,28,SesDRUUCZvQ,Wo stree hai kuch bhi kar sakti hai 🤪  |  naaa karwaegi 🤪 #vishalbhatt  #comedy  #shorts,,https://i.ytimg.com/vi/SesDRUUCZvQ/default.jpg,1167754,2,13,4,88,sv,0,1,0,3,tl
779,779,29,SzXJGrxdMSs,#comedy #funny #tomboy,,https://i.ytimg.com/vi/SzXJGrxdMSs/default.jpg,12649082,0,3,3,22,en,0,1,0,3,tl
780,780,30,LXcFazHSCg4,Bryan Cranston&#39;s Amazing Comedy &amp; Drama Advice,Submit your FEATURE Film Screenplay: https://www.outstandingscreenplays.com/competitions-feature Have an idea for a TV ...,https://i.ytimg.com/vi/LXcFazHSCg4/default.jpg,5223364,0,9,5,54,en,0,17,11,122,en
781,781,31,fGLDMZ-jJfQ,&quot;Male Feminism&quot; 🎤: Erica Rhodes #donttellcomedy #ericarhodes #standup #comedy,Subscribe to our channel and check out the full set from Erica Rhodes! http://bit.ly/dtcyoutube Get on our secret email list at the ...,https://i.ytimg.com/vi/fGLDMZ-jJfQ/default.jpg,113259,1,10,9,87,ca,0,25,9,135,en
782,782,32,g2LWD8dRqis,Happens 🤣🔥 #mabucrush #comedy,,https://i.ytimg.com/vi/g2LWD8dRqis/default.jpg,2060930,2,3,2,29,en,0,1,0,3,tl
783,783,33,0VK_p4uuEjk,Kesi rahi medam😂 #shorts #comedy #funny,,https://i.ytimg.com/vi/0VK_p4uuEjk/default.jpg,1943775,1,6,3,39,en,0,1,0,3,tl
784,784,34,HRiENgF7PSs,Crazy Girl prank 😲🔥 #pranks #funny #comedy,Crazy Girl prank.,https://i.ytimg.com/vi/HRiENgF7PSs/default.jpg,541472,2,6,3,42,pl,0,3,1,17,pl
785,785,35,mQDo73v9HMk,Is There Comedy in North Korea? (ft. Yeonmi Park),Watch Full Episode - https://youtu.be/6FbR9c2n6e8 Flagrant Fan Favorite Yeonmi Park joins Comedian Andrew Schulz to talk ...,https://i.ytimg.com/vi/mQDo73v9HMk/default.jpg,2654096,0,9,4,49,en,0,18,9,124,en
786,786,36,F1C9fcldEkU,“Friends in Prison” 🎤: Ralph Barbosa - #comedy #ralphbarbosa #donttellcomedy #shorts,Subscribe to our channel and check out the full set from Ralph Barbosa! http://bit.ly/dtcyoutube Get on our secret email list at the ...,https://i.ytimg.com/vi/F1C9fcldEkU/default.jpg,19142122,1,9,6,84,en,0,25,9,136,en
787,787,37,nH_bEtbfB9U,The First Stand-Up Comedy Special Written Entirely By Bots,We worked with Keaton Patti to make a bot watch over 400000 hours of stand up comedy and then write its own special. Here is ...,https://i.ytimg.com/vi/nH_bEtbfB9U/default.jpg,2732577,0,10,1,58,en,0,25,4,128,en
788,788,38,qBTkRgk0I2Y,teachers when they have a tr@ns student #shorts #comedy #funny,,https://i.ytimg.com/vi/qBTkRgk0I2Y/default.jpg,1227047,0,11,4,62,en,0,1,0,3,tl
789,789,39,AsoYV2eElco,Men will be men😂 #shorts #comedy #couple #funny #jahaann,,https://i.ytimg.com/vi/AsoYV2eElco/default.jpg,3392650,1,9,5,56,en,0,1,0,3,tl
790,790,40,XNp2UjqGY-s,😈Google Poi Soladhu..🤣🤣#anjuzlifestyle #funny #shorts #coimbatore #chennai #comedy #tamil,anjuzlifestyle #tamil #shorts #funny #youtubeshorts.,https://i.ytimg.com/vi/XNp2UjqGY-s/default.jpg,514706,3,10,9,89,en,0,5,5,52,en
791,791,41,MviZBNIbVO4,The Honest Girlfriend 🔥 | most viral comedy 😂 #ytshorts #shorts,,https://i.ytimg.com/vi/MviZBNIbVO4/default.jpg,5730850,2,8,3,63,en,0,1,0,3,tl
792,792,42,l8WD1x_Dlgk,Chris Rock Slams Will Smith For Oscars Slap in Live Comedy Special for Netflix | THR News,"""You will never see me on Oprah crying. It's never gonna happen,"" the comedian said. To read more about this story: ...",https://i.ytimg.com/vi/l8WD1x_Dlgk/default.jpg,12443,0,16,1,89,en,0,22,10,119,en
793,793,43,NwriiH-4b1k,Happy Holi by Upboyraj Pradeep Raj 😜🤣😜 @YouTube #funny #viral #comedy #trending #youtube #holi,,https://i.ytimg.com/vi/NwriiH-4b1k/default.jpg,637002,3,13,7,94,en,0,1,0,3,tl
794,794,44,LlFOcoE8RfY,Wait for twist 😎😂#shorts #funny #comedy,,https://i.ytimg.com/vi/LlFOcoE8RfY/default.jpg,17479434,2,6,3,39,en,0,1,0,3,tl
795,795,45,9X-DZn3HVvk,Naiyo lagda dil 😂🤣 | oye indori #oyeindori #comedy,,https://i.ytimg.com/vi/9X-DZn3HVvk/default.jpg,2060283,2,7,3,50,it,0,1,0,3,tl
796,796,46,iHQrupwre9s,Kismat e kharab hai 🤪 | oh bhai maro mujhe maro 🤪 #vishalbhatt  #comedy  #tagsomeone,,https://i.ytimg.com/vi/iHQrupwre9s/default.jpg,1755432,2,12,4,84,en,0,1,0,3,tl
797,797,47,6Zh8twFLhNI,ISSEI funny video 😂😂😂 New Comedy Rimix #memes #shorts,issei #issei0806 #meme #memes #comedy #viral #trending #entertaining.,https://i.ytimg.com/vi/6Zh8twFLhNI/default.jpg,1132727,3,8,2,53,en,0,8,8,69,nl
798,798,48,Ng_ryUiH6cE,TRAIN YATRA 10 | joke of | kanpuriya comedy | make joke | animo fun,TRAIN YATRA 10 | joke of | kanpuriya comedy | make joke | animo fun #desicomedy #jokeof #csbishtvines #comedy #jokes ...,https://i.ytimg.com/vi/Ng_ryUiH6cE/default.jpg,43889,0,11,4,67,sw,0,16,12,120,en
799,799,49,-_v8lVufppE,If HANDS were HUMANS😂#Funcho #Comedy #Funny #Shorts,,https://i.ytimg.com/vi/-_v8lVufppE/default.jpg,8719785,1,8,4,51,en,0,1,0,3,tl
800,800,0,v1Yv8fS78bc,Cooking a Brisket Like a Steak,Why is a medium rare filet mignon extremely tender and juicy while a medium rare brisket is completely inedible? On the other ...,https://i.ytimg.com/vi/v1Yv8fS78bc/default.jpg,3195846,0,6,0,30,no,0,22,4,129,en
801,801,1,7PmCbqCkihk,3 Levels of Chicken Nuggets,,https://i.ytimg.com/vi/7PmCbqCkihk/default.jpg,1336983,0,5,0,27,en,0,1,0,3,tl
802,802,2,sc3-2mA7yn0,Cooking Lobster In ONLY Butter (ft. Max),shorts #lobster #butter.,https://i.ytimg.com/vi/sc3-2mA7yn0/default.jpg,6027605,0,7,3,40,de,0,3,3,24,en
803,803,3,DH4SaUDZiXg,Baby Thinks Cooking Asparagus Is the Funniest Thing Ever #shorts,"A multi-tasking dad had his baby in stitches; every time he snapped a piece of asparagus, the little one giggled.",https://i.ytimg.com/vi/DH4SaUDZiXg/default.jpg,93896,0,10,1,64,en,0,21,4,113,en
804,804,4,Jd_zJVwHIN8,COOKING WITH THE PRESIDENTS PERSONAL CHEF!,CHEF RUSH.,https://i.ytimg.com/vi/Jd_zJVwHIN8/default.jpg,862087,0,6,1,42,en,0,2,1,10,ro
805,805,5,XA1auynQxQI,I Cooked Salmon on a Deserted Island,LisaNguyen's fish was bigger than mine Shoutout to @CopperRiverSalmon for an awesome trip and Orca Lodge in Cordova ...,https://i.ytimg.com/vi/XA1auynQxQI/default.jpg,504518,0,7,0,36,en,0,19,5,119,en
806,806,6,AmC9SmCBUj4,Gordon Ramsay&#39;s ULTIMATE COOKERY COURSE: How to Cook the Perfect Steak,You can now pre-order Gordon Ramsay's new book - Ultimate Home Cooking - before it's release 29th August 2013. Gordon ...,https://i.ytimg.com/vi/AmC9SmCBUj4/default.jpg,29791809,0,13,4,74,en,0,21,9,121,en
807,807,7,0zjo_FPEXlU,Chicken Mandi #shorts,,https://i.ytimg.com/vi/0zjo_FPEXlU/default.jpg,1623910,0,3,1,21,en,0,1,0,3,tl
808,808,8,V7UgPHjN9qE,Drake ft. 21 Savage - Jimmy Cooks (Official Audio),"Official audio for Drake “Jimmy Cook's” (feat. 21 Savage) off the new album 'Honestly, Nevermind' available everywhere now: ...",https://i.ytimg.com/vi/V7UgPHjN9qE/default.jpg,56881977,0,8,4,50,en,0,19,11,127,en
809,809,9,1RMKR8h03iw,Lego Breakfast - Lego In Real Life 5 / Stop Motion Cooking &amp; ASMR,"Hello I'm tomosteen. Thanks for watching, The fifth installment of Lego In Real Life on my channel is a breakfast of bread, ...",https://i.ytimg.com/vi/1RMKR8h03iw/default.jpg,49559531,0,12,4,69,en,0,23,7,127,en
810,810,10,YPL1JaJwxgQ,Yummy Miniature Spaghetti American Style | Best Of Miniature Cooking Recipe | Tiny Cakes,Story of the day: Learn how to make miniature spaghetti american style in tiny kitchen. This recipe is so easy and delicious.,https://i.ytimg.com/vi/YPL1JaJwxgQ/default.jpg,49669012,0,12,2,88,en,0,22,3,125,en
811,811,11,GNCQgYoYUe8,Cooking For The Hottest Teacher In NYC | Food Budget: $800 #shorts,,https://i.ytimg.com/vi/GNCQgYoYUe8/default.jpg,48628,0,11,4,66,en,0,1,0,3,tl
812,812,12,4hEKKTF7Lak,Cat Cooking Show,Aaron's Animals - Michael's Kitchen Prince Michael's Personal Instagram➤ https://www.instagram.com/michaelismename/ ...,https://i.ytimg.com/vi/4hEKKTF7Lak/default.jpg,13079198,0,3,0,16,en,0,16,14,119,en
813,813,13,hHmIKN_8-08,Naan at home 🫓 #shorts,Naan bread Ingredients - 2 1/4 cups all-purpose flour - 1 tsp sugar - 1/2 cup warm water - 7g tsp active dry yeast - 3 heaped tbsp ...,https://i.ytimg.com/vi/hHmIKN_8-08/default.jpg,992777,1,4,1,22,en,0,26,11,134,en
814,814,14,e075sWr9R58,COOKING PASTA WITH SHANIA TWAIN,,https://i.ytimg.com/vi/e075sWr9R58/default.jpg,1822318,0,5,0,31,en,0,1,0,3,tl
815,815,15,QUfJ81Kmu78,Garlic Basted Sirloin Skewers | Over The Fire Cooking by Derek Wolf,Garlic Basted Sirloin Skewers is what's for dinner! Garlic Basted Sirloin Skewers are our new favorite; classic flavors ...,https://i.ytimg.com/vi/QUfJ81Kmu78/default.jpg,282710,0,11,1,67,en,0,19,6,123,en
816,816,16,UYhKDweME3A,How To Cook The Perfect Pasta | Gordon Ramsay,"Top tips on how to how to cook angel hair pasta - with principles that you can apply to cooking any shape. If you have any others, ...",https://i.ytimg.com/vi/UYhKDweME3A/default.jpg,9571505,0,8,1,45,en,0,26,6,134,en
817,817,17,YLEIO0mfU6A,THIS IS BUTTER!! #shortsvideo #chef #foodie #cooking #recipe #foodie,,https://i.ytimg.com/vi/YLEIO0mfU6A/default.jpg,11203812,0,9,8,68,en,0,1,0,3,tl
818,818,18,A_lkQMaaorA,6 Ways to Peel a Pomegranate - You Suck at Cooking (episode 135),Removing seeds from a pomegranate can be done in 6 different ways. But not 7. 7 is too many ways. Subscribe: ...,https://i.ytimg.com/vi/A_lkQMaaorA/default.jpg,3407473,0,12,3,64,en,0,21,7,112,en
819,819,19,4Vm-w8txAGk,This is how I cook green beans 😼,Michigan Green Bean Queen's green bean recipe here: https://msshiandmrhe.com/din-tai-fung-green-beans/,https://i.ytimg.com/vi/4Vm-w8txAGk/default.jpg,1223930,1,7,0,32,en,0,17,12,102,nl
820,820,20,Z1oYGawjFnY,COOKING WITH LIVERKING,,https://i.ytimg.com/vi/Z1oYGawjFnY/default.jpg,13017535,0,3,0,22,de,0,1,0,3,tl
821,821,21,8hHkdPDALiU,The Rarest Steak I’ve Ever Cooked,The Rarest Steak I've Ever Cooked Took two years to cook it but thank you @NickDiGiovanni for the steak!,https://i.ytimg.com/vi/8hHkdPDALiU/default.jpg,2459118,0,7,0,33,en,0,20,3,104,en
822,822,22,-OE6LhxsTNA,Cooking A Whole Salmon,shorts #salmon #fish #sushi.,https://i.ytimg.com/vi/-OE6LhxsTNA/default.jpg,19343900,0,4,0,22,en,0,4,4,28,en
823,823,23,Fb4Wi3KFoJM,Most-SHOCKING Moments | Worst Cooks in America | Food Network,"It wouldn't be #WorstCooks Boot Camp without fire, smoke and at least a few earth-shattering screams! Subscribe ...",https://i.ytimg.com/vi/Fb4Wi3KFoJM/default.jpg,12871698,0,9,3,61,en,0,19,8,115,en
824,824,24,pXg5qkCS1uo,"Cooking Dinner For A Couple In Their Insane NYC Penthouse | Food Budget: $6,000 per month #shorts",,https://i.ytimg.com/vi/pXg5qkCS1uo/default.jpg,127943,0,17,5,97,en,0,1,0,3,tl
825,825,25,uTQ1oCVR74o,The Makanai: Cooking for the Maiko House | Official Trailer | Netflix,"Set in the geisha district of Kyoto, this series follows Sumire, a maiko (apprentice geisha) and Kiyo, a cook at the maiko house ...",https://i.ytimg.com/vi/uTQ1oCVR74o/default.jpg,257748,0,10,3,69,en,0,23,8,132,en
826,826,26,wx67BStCv94,3 Levels of Ramen!?!,,https://i.ytimg.com/vi/wx67BStCv94/default.jpg,52534271,0,4,3,20,en,0,1,0,3,tl
827,827,27,OMRUIrbZDpM,How To Cook Pasta Properly ( Step by Step Pasta Cooking ),How To Cook Pasta Properly ( Step by Step Pasta Cooking ) Basic Cooking of Spaghetti Pasta or any type of Pasta. See Full ...,https://i.ytimg.com/vi/OMRUIrbZDpM/default.jpg,2003215,0,10,2,57,en,0,22,6,125,en
828,828,28,GslIJnYDeOA,Try this GARLIC HACK for faster cooking,Check out recipes on the blog: https://jeanelleats.com/ #cookinghacks #cookingtips #kitchenhacks #kitchentips #garlic #garlicrice ...,https://i.ytimg.com/vi/GslIJnYDeOA/default.jpg,256347,0,7,0,39,en,0,15,15,133,en
829,829,29,mOy0kO4Y0og,Green Brinjal Curry Recipe | Village Cooking | Side Dish Recipes,,https://i.ytimg.com/vi/mOy0kO4Y0og/default.jpg,35204,0,9,2,64,en,0,1,0,3,tl
830,830,30,81KbmZjiGJE,Customer States Car Runs Rough Since They Added Cooking Oil To Engine  | Just Rolled In,"Welcome to Just Rolled In! For today's episode, we have some customer states photos and videos from all around the web and ...",https://i.ytimg.com/vi/81KbmZjiGJE/default.jpg,1148110,0,15,1,87,en,0,23,6,126,en
